{
  "$schema": "https://json-schema.org/draft/2020-12/schema",
  "$id": "https://contentcloud.local/schemas/creative-environment-profile-1.0.schema.json",
  "title": "Creative Environment Profile 1.0",
  "type": "object",
  "additionalProperties": false,
  "required": ["id", "version", "environment_version", "harness", "marketplace", "plugins", "workspace_template", "capabilities", "policies"],
  "properties": {
    "id": {"type": "string", "pattern": "^[a-z0-9]+(?:[._-][a-z0-9]+)*$"},
    "version": {"$ref": "#/$defs/version"},
    "environment_version": {"$ref": "#/$defs/version"},
    "harness": {"const": "codex"},
    "marketplace": {"type": "string", "pattern": "^[a-z0-9]+(?:-[a-z0-9]+)*$"},
    "plugins": {
      "type": "array",
      "minItems": 1,
      "items": {
        "type": "object",
        "additionalProperties": false,
        "required": ["id", "kind", "version", "required", "scope", "capabilities"],
        "properties": {
          "id": {"type": "string", "pattern": "^[a-z0-9]+(?:-[a-z0-9]+)*$"},
          "kind": {"enum": ["scene_plugin", "skill_pack", "provider_mcp_pack"]},
          "version": {"$ref": "#/$defs/version"},
          "required": {"type": "boolean"},
          "scope": {"enum": ["environment", "task"]},
          "capabilities": {"$ref": "#/$defs/capabilities"}
        }
      }
    },
    "workspace_template": {"$ref": "creative-environment-manifest-1.0.schema.json#/$defs/workspace_template"},
    "capabilities": {"$ref": "#/$defs/capabilities"},
    "policies": {"$ref": "creative-environment-manifest-1.0.schema.json#/$defs/policies"}
  },
  "$defs": {
    "version": {"type": "string", "pattern": "^\\d+\\.\\d+\\.\\d+(?:-[0-9A-Za-z.-]+)?$"},
    "capabilities": {"type": "array", "minItems": 1, "uniqueItems": true, "items": {"type": "string", "pattern": "^[a-z0-9]+(?:[._-][a-z0-9]+)*$"}}
  }
}
